<?xml version="1.0" encoding="UTF-8"?>
<!DOCTYPE cancion SYSTEM "validacion.dtd">
<cancion duracion="4:08" anno="1979">

    <titulo>Video Killed the Radio Star</titulo>
    <compositores>
        <compositor>
            <nombre>Geoff</nombre>
            <apellidos>Downes</apellidos>
        </compositor>

        <compositor>
            <nombre>Trevor</nombre>
            <apellidos>Horn</apellidos>
        </compositor>

        <compositor>
            <nombre>Bruce</nombre>
            <apellidos>Woolley</apellidos>
        </compositor>

    </compositores>

    <disco>
        <nombre>The Age of Plastic</nombre>
    </disco>

    <sello>
        <nombre>Island</nombre>
    </sello>

    <artistas>
        <artista>
            <nombre>Buggles</nombre>
        </artista>
    </artistas>

</cancion>